{
 "source": "https://www.youtube.com",
 "source_name": "全球周更评议节目判例索引（YouTube 官方频道/播放列表元数据）",
 "fetched": "2026-10-26",
 "shows": {
  "sfa": {
   "name": "The VAR Review",
   "org": "Scottish FA（苏格兰足总）",
   "lang": "en",
   "update": "月更",
   "url": "https://www.youtube.com/channel/UChaFW_N-7dndut-HC4Exe-g"
  },
  "tff": {
   "name": "VAR Kayıtları – Sahada İnceleme",
   "org": "Türkiye Futbol Federasyonu（土耳其足协）",
   "lang": "tr",
   "update": "周更",
   "url": "https://www.youtube.com/channel/UCVoNfzLtczc_TV8-xKjcmKg"
  },
  "jleague": {
   "name": "Jリーグ審判レポート（シンレポ）",
   "org": "Jリーグ（日本职业足球联赛）",
   "lang": "ja",
   "update": "约月更",
   "url": "https://www.youtube.com/playlist?list=PLkPh_QuTENJIRqYZRyCH1QcjEEGpkjrmS"
  },
  "england": {
   "name": "Match Officials: Mic'd Up",
   "org": "Sky Sports / PGMOL（英格兰）",
   "lang": "en",
   "update": "月更",
   "url": "https://www.youtube.com/channel/UCNAf1k0yIjyGu3k9BwAg3lg"
  },
  "fmx": {
   "name": "VAR Review",
   "org": "Comisión de Árbitros · FMF（墨西哥足协裁判委员会）",
   "lang": "es",
   "update": "不定期",
   "url": "https://www.youtube.com/channel/UCdqXXpzLUYbfckwnGIgR_8g"
  },
  "afa": {
   "name": "VAR Revisión",
   "org": "Liga Profesional de Fútbol · AFA（阿根廷职业联赛）",
   "lang": "es",
   "update": "每轮",
   "url": "https://www.youtube.com/channel/UCJmCVoUfCBQb9lcfXIS8nXQ"
  },
  "rfs": {
   "name": "Судейский разбор",
   "org": "РФС ТВ（俄罗斯足协）",
   "lang": "ru",
   "update": "不定期",
   "url": "https://www.youtube.com/channel/UCLNgRqvauqKU6SOzdAJSQaw"
  },
  "uaf": {
   "name": "Коментар епізодів（判例解读）",
   "org": "UAF 裁判委员会（乌克兰足协）",
   "lang": "uk",
   "update": "每轮",
   "url": "https://uaf.ua/referee-committee"
  }
 },
 "episodes": [
  {
   "id": "7-tur-upl-20262027-komentar-epizodiv-vid-komitetu-arbitriv-uaf",
   "show": "uaf",
   "title": "7 тур УПЛ-2026/2027: коментар епізодів від Комітету арбітрів УАФ",
   "url": "https://uaf.ua/news/7-tur-upl-20262027-komentar-epizodiv-vid-komitetu-arbitriv-uaf",
   "date": "2026-10-01",
   "date_src": "exact",
   "desc": "",
   "views": null,
   "length": ""
  },
  {
   "id": "9AW4mSrrIsw",
   "title": "VAR 2026 | #InternationalSupercup - Fourth edition | ESTUDIANTES - ROSARIO CENTRAL",
   "url": "https://www.youtube.com/watch?v=9AW4mSrrIsw",
   "date": "2026-09-28",
   "date_src": "exact",
   "desc": "",
   "views": null,
   "length": "2:34",
   "show": "afa"
  },
  {
   "id": "Fjv4XzpzIVM",
   "title": "VAR 2026 | #InternationalSuperCup - Fourth edition | ESTUDIANTES - ROSARIO CENTRAL (audio 2)",
   "url": "https://www.youtube.com/watch?v=Fjv4XzpzIVM",
   "date": "2026-09-28",
   "date_src": "exact",
   "desc": "",
   "views": null,
   "length": "1:51",
   "show": "afa"
  },
  {
   "id": "yXsoC3ItK18",
   "title": "Trendyol Süper Lig | 6. Hafta | VAR Kayıtları | Sahada İnceleme",
   "date": "2026-09-21",
   "date_src": "exact",
   "url": "https://www.youtube.com/watch?v=yXsoC3ItK18",
   "desc": "Trendyol Süper Lig’in 6. haftasında oynanan müsabakaların sahada incelemeye giden VAR kayıtları.",
   "views": 18102,
   "length": "4:02",
   "show": "tff"
  },
  {
   "id": "JjAO58MYaAU",
   "title": "VAR 2026 | #TorneoMercadoLibre Clausura 2026 | Fecha 10 | ROSARIO CENTRAL - ARGENTINOS",
   "date": "2026-09-21",
   "date_src": "exact",
   "url": "https://www.youtube.com/watch?v=JjAO58MYaAU",
   "desc": "",
   "views": 1586,
   "length": "1:33",
   "show": "afa"
  },
  {
   "id": "gX6KSOxqDcA",
   "title": "Trendyol Süper Lig | 5. Hafta | VAR Kayıtları | Sahada İnceleme",
   "date": "2026-09-15",
   "date_src": "exact",
   "url": "https://www.youtube.com/watch?v=gX6KSOxqDcA",
   "desc": "Trendyol Süper Lig’in 5. haftasında oynanan müsabakaların sahada incelemeye giden VAR kayıtları.",
   "views": 18712,
   "length": "7:25",
   "show": "tff"
  },
  {
   "id": "CUrlkWUpPuQ",
   "title": "FULL VAR AUDIO of Haaland's controversial Manchester derby winner | Match Officials Mic'd Up",
   "url": "https://www.youtube.com/watch?v=CUrlkWUpPuQ",
   "date": "2026-09-15",
   "date_src": "exact",
   "desc": "",
   "views": null,
   "length": "7:35",
   "show": "england"
  },
  {
   "id": "r13igve_wXI",
   "title": "VAR 2026 | #TorneoMercadoLibre Clausura 2026 | Fecha 9 | ATLÉTICO TUCUMÁN - RIVER",
   "date": "2026-09-14",
   "date_src": "exact",
   "url": "https://www.youtube.com/watch?v=r13igve_wXI",
   "desc": "📲 Diálogos de las autoridades arbitrales de campo y #VAR en el encuentro Atlético Tucumán - River por la #Fecha9 del #TorneoMercadoLibre Clausura 2026 🏆\n\nInstagram: https://www.instagram.com/ligaprofesionalAFA \nTwitter: https://www.twitter.com/ligaAFA/ \nFacebook: https://www.facebook.com/ligaprofesionalAFA \nTikTok: https://www.tiktok.com/@ligaprofesional\nTwitch: https://www.twitch.tv/ligaprofesional\nWhatsApp: https://whatsapp.com/channel/0029VaDAKLfHFxOwQiv23g3d \n\n#LPF #LigaProfesional",
   "views": 1811,
   "length": "1:25",
   "show": "afa"
  },
  {
   "id": "F768xBom5kI",
   "title": "VAR 2026 | #TorneoMercadoLibre Clausura 2026 | Fecha 9 | INDEPENDIENTE RIVADAVIA - ALDOSIVI",
   "date": "2026-09-14",
   "date_src": "exact",
   "url": "https://www.youtube.com/watch?v=F768xBom5kI",
   "desc": "Instagram: https://www.instagram.com/ligaprofesionalAFA \nTwitter: https://www.twitter.com/ligaAFA/ \nFacebook: https://www.facebook.com/ligaprofesionalAFA \nTikTok: https://www.tiktok.com/@ligaprofesional\nTwitch: https://www.twitch.tv/ligaprofesional\nWhatsApp: https://whatsapp.com/channel/0029VaDAKLfHFxOwQiv23g3d \n\n#LPF #LigaProfesional",
   "views": 822,
   "length": "1:33",
   "show": "afa"
  },
  {
   "id": "komitet-arbitriv-uaf-provede-seminary-ta-fitnes-testy-dlia-referi-pfl-nlm-ta-nshfa",
   "show": "uaf",
   "title": "Комітет арбітрів УАФ проведе семінари та фітнес-тести для рефері ПФЛ, НЛМ та НШФА",
   "url": "https://uaf.ua/news/komitet-arbitriv-uaf-provede-seminary-ta-fitnes-testy-dlia-referi-pfl-nlm-ta-nshfa",
   "date": "2026-09-14",
   "date_src": "exact",
   "desc": "",
   "views": null,
   "length": ""
  },
  {
   "id": "HNQaFXr3GgQ",
   "title": "The VAR Review with Willie Collum & Gordon Duncan | NEW Season | Show One | August & September 2026",
   "date": "2026-09-11",
   "date_src": "exact",
   "url": "https://www.youtube.com/watch?v=HNQaFXr3GgQ",
   "desc": "Be Part Of The Game. Be A Referee: https://scotfa.co/becomeareferee\n\nThe VAR Review is a monthly show from the Scottish FA and Sky Sports that gives Scottish football fans a behind the closer look at some of the big decisions made across the game – whether they are right or whether they are wrong – and how those decisions are reached. Get unique insight through the use of VAR and referee audio.\n\nHost Gordon Duncan is joined by Head of Refereeing, Willie Collum, for the latest show, which looks back at matches that took place in August & September 2026.\n\n0:00 – Show Intro\n0:28 – St Mirren v Celtic\n04:28 – St Mirren v Celtic – Incident Two\n08:33 – St Mirren v Motherwell\n12:13 – Rangers v Hibernian\n16:32 – Heart of Midlothian v Dundee United\n17:02 – Aberdeen v Rangers\n20:20 – Hibernian v Heart of Midlothian\n22:36 – Dundee United v Celtic\n26:00 – Falkirk v St Mirren\n30:25 – Aberdeen v Heart of Midlothian\n32:47 – Hibernian v Motherwell\n33:25 – Kilmarnock v St Mirren\n35:36 – Dundee United v Dundee\n38:16 – Show Outro\n\n© The Scottish Football Association 2026\n \nThis video is copyrighted by the Scottish FA and must not be republished either in its entirety and/or clips or still images without the prior written consent of the Scottish FA.",
   "views": 32489,
   "length": "38:31",
   "show": "sfa"
  },
  {
   "id": "5-tur-upl-20262027-komentar-epizodiv-vid-komitetu-arbitriv-uaf",
   "show": "uaf",
   "title": "5 тур УПЛ-2026/2027: коментар епізодів від Комітету арбітрів УАФ",
   "url": "https://uaf.ua/news/5-tur-upl-20262027-komentar-epizodiv-vid-komitetu-arbitriv-uaf",
   "date": "2026-09-11",
   "date_src": "exact",
   "desc": "",
   "views": null,
   "length": ""
  },
  {
   "id": "komitet-arbitriv-uaf-provede-seminar-ta-fitnes-test-dlia-referi-upl",
   "show": "uaf",
   "title": "Комітет арбітрів УАФ проведе семінар та фітнес-тест для рефері УПЛ",
   "url": "https://uaf.ua/news/komitet-arbitriv-uaf-provede-seminar-ta-fitnes-test-dlia-referi-upl",
   "date": "2026-09-11",
   "date_src": "exact",
   "desc": "",
   "views": null,
   "length": ""
  },
  {
   "id": "xHApx1kGALI",
   "title": "Trendyol Süper Lig | 4. Hafta | VAR Kayıtları | Sahada İnceleme",
   "date": "2026-09-08",
   "date_src": "exact",
   "url": "https://www.youtube.com/watch?v=xHApx1kGALI",
   "desc": "Trendyol Süper Lig’in 4. haftasında oynanan müsabakaların sahada incelemeye giden VAR kayıtları.",
   "views": 16843,
   "length": "2:55",
   "show": "tff"
  },
  {
   "id": "-oZ6p5MgH84",
   "title": "VAR 2026 | #TorneoMercadoLibre Clausura 2026 | Fecha 8 | RACING - ATLÉTICO TUCUMÁN",
   "date": "2026-09-07",
   "date_src": "exact",
   "url": "https://www.youtube.com/watch?v=-oZ6p5MgH84",
   "desc": "📲 Diálogos de las autoridades arbitrales de campo y #VAR en el encuentro Racing - Atlético Tucumán por la #Fecha8 del #TorneoMercadoLibre Clausura 2026 🏆\n\nInstagram: https://www.instagram.com/ligaprofesionalAFA \nTwitter: https://www.twitter.com/ligaAFA/ \nFacebook: https://www.facebook.com/ligaprofesionalAFA \nTikTok: https://www.tiktok.com/@ligaprofesional\nTwitch: https://www.twitch.tv/ligaprofesional\nWhatsApp: https://whatsapp.com/channel/0029VaDAKLfHFxOwQiv23g3d \n\n#LPF #LigaProfesional",
   "views": 1451,
   "length": "2:47",
   "show": "afa"
  },
  {
   "id": "aDdeHid0ev4",
   "title": "Trendyol Süper Lig | 3. Hafta | VAR Kayıtları | Sahada İnceleme",
   "url": "https://www.youtube.com/watch?v=aDdeHid0ev4",
   "date": "2026-09-01",
   "date_src": "exact",
   "desc": "",
   "views": null,
   "length": "4:24",
   "show": "tff"
  },
  {
   "id": "uyrgUqM9iSA",
   "title": "VAR 2026 | #TorneoMercadoLibre Clausura 2026 | Matchday 7 | BANFIELD - RIVER",